isbn,title,num_pages,publication_date,book_id
2226135510,L'Aube du désert,288,2002-11-1,2399
582435676,The Beach,112,2001-2-19,2400
91881803,The Weekenders: Travels in the Heart of Africa,340,2001-11-8,2401
307264556,I Feel Bad About My Neck: And Other Thoughts on Being a Woman,137,2006-8-1,2402
345487427,Feel the Fear . . . and Do It Anyway,217,2006-12-26,2403
789488779,Touch & Feel: Animals Boxed Set,36,2003-2-15,2404
60245603,Today I Feel Silly  Other Moods That Make My Day,40,2007-7-31,2405
789479311,My First Word Touch and Feel,12,2001-9-19,2406
807588970,When I Feel Angry,24,2000-1-1,2407
786818727,Violet's House: A Giant Touch-and-Feel Book (Baby Einstein),10,2003-11-1,2408
61131520,The White Masai,320,2006-10-10,2409
439401879,The Story of a Seagull and the Cat Who Taught Her to Fly,128,2006-8-1,2410
8439710097,Ahora sabréis lo que es correr,400,2004-3-31,2411
486428400,The Burgess Bird Book for Children,260,2003-4-23,2412
486437450,The Burgess Animal Book for Children,275,2004-9-10,2413
486280233,The Adventures of Jimmy Skunk,96,1994-5-20,2414
393315088,The Wanting Seed,288,1996-12-17,2415
141182601,A Clockwork Orange,159,2000-2-24,2416
014027409X,A Clockwork Orange,149,1998-9-3,2417
345316413X,Clockwork Orange,235,2000-3-1,2418
413735907,A Clockwork Orange (Stage Play),51,2017-3-10,2419
786706317,One Hand Clapping,224,1999-7-15,2420
393316025,The Doctor is Sick,260,1997-8-17,2421
99468646,Earthly Powers,649,2004-5-6,2422
552771236,Past Mortem,460,2005-5-2,2423
055277183X,This Other Eden,400,2003-7-1,2424
805079130,Saint-Exupéry,560,2006-2-7,2425
2070513289,Le Petit Prince,123,2004-2-1,2426
743477103,Macbeth,249,2013-7-1,2427
812035712,Macbeth,224,1985-4-1,2428
446606987,Death of a Scriptwriter (Hamish Macbeth  #14),198,1999-6-1,2429
446614890,Death of a Poison Pen (Hamish Macbeth  #19),227,2005-1-1,2430
446614726,Death of an Outsider (Hamish Macbeth  #3),194,2005-7-1,2431
764586025,Cliffs Notes on Shakespeare's Macbeth,112,2000-5-30,2432
446608289,Death of an Addict (Hamish Macbeth  #15),214,2001-3-1,2433
60088745,A Year in the Life of William Shakespeare: 1599,333,2006-6-13,2434
448439042,Who Was William Shakespeare?,105,2006-12-28,2435
517209489,Planet of the Apes,192,2000-6-6,2436
60086211,Planet of the Apes: Colony,288,2003-3-25,2437
1569716684,Planet of the Apes  Volume 1: Old Gods,80,2002-3-5,2438
60086203,Planet of the Apes: The Fall,288,2002-6-4,2439
345251679,Return to the Planet of the Apes #2: Escape from Terror Lagoon,0,1976-4-12,2440
345251229,Return to the Planet of the Apes:  Visions from Nowhere,183,1976-6-1,2441
184023380X,Planet of the Apes: The Human War,72,2001-7-27,2442
891901639,Battle for the Planet of the Apes,158,1973-6-1,2443
307346609,World War Z: An Oral History of the Zombie War,342,2006-9-12,2444
375759239,The War of the Worlds,192,2002-3-12,2445
805076239,The Second World War: A Complete History,928,2004-6-1,2446
688085873,A Short History of World War II,416,1980-1-1,2447
517052253,The Complete Science Fiction Treasury of H.G. Wells,0,1987-6-24,2448
486215318,Best Science Fiction Stories of H. G. Wells,320,2011-11-24,2449
439574277,The Invisible Man,208,2004-9-1,2450
451528018,The Hound of the Baskervilles,256,2001-7-1,2451
9626343346,The Hound of the Baskervilles (Sherlock Holmes  #5),5,2005-3-30,2452
763630640,The Hound of the Baskervilles,272,2006-8-22,2453
1596792507,Sherlock Holmes and the Case of the Hound of the Baskervilles (Great Illustrated Classics),237,2005-1-1,2454
1401301959,Jamie's Italy,320,2006-11-14,2455
1401301940,Jamie's Dinners: The Essential Family Cookbook,336,2004-11-3,2456
316016659,The Lake of Souls (Cirque du Freak #10),272,2006-9-6,2457
439286069,Freak the Mighty (Freak The Mighty  #1),169,2001-6-1,2458
142002267,Word Freak: Heartbreak  Triumph  Genius  and Obsession in the World of Competitive Scrabble Players,372,2002-7-30,2459
316905747,Vampire Mountain (Cirque Du Freak  #4),208,2003-9-1,2460
1577780728,Jesus Freaks: Stories of Those Who Stood for Jesus  the Ultimate Jesus Freaks (Jesus Freaks  #1),383,1999-1-15,2461
316000957,Trials of Death (Cirque Du Freak  #5),202,2008-1-18,2462
446695602,Sister Freaks: Stories of Women Who Gave Up Everything for God,320,2005-10-5,2463
1560258012,Freaks of the Storm: From Flying Cows to Stealing Thunder: The World's Strangest True Weather Stories,371,2006-12-29,2464
226063127,Freak Show: Presenting Human Oddities for Amusement and Profit,336,1990-5-15,2465
1577782089,Live Like a Jesus Freak: Spend Today as If It Were Your Last,184,2001-11-1,2466
823016625,Freaks!: How to Draw Fantastic Fantasy Creatures,144,2004-6-1,2467
976249871,Jesus Freaks,390,2006-4-20,2468
1588993000,Category: Freaks  Vol. 1 (Category: Freaks  #1),184,2005-7-1,2469
1583227202,Hello Cruel World: 101 Alternatives to Suicide for Teens  Freaks  and Other Outlaws,234,2006-5-2,2470
767916034,Don't Get Too Comfortable: The Indignities of Coach Class  The Torments of Low Thread Count  The Never-Ending Quest for Artisanal Olive Oil  and Other First World Problems,222,2006-9-12,2471
806527285,I Hope They Serve Beer in Hell (Tucker Max  #1),288,2006-1-1,2472
316779237,Holidays on Ice,134,1998-11-1,2473
1592289444,The Long Walk: The True Story of a Trek to Freedom,256,2006-4-1,2474
451196716,The Long Walk,370,1999-4-1,2475
1586216880,Long Walk to Freedom: Autobiography of Nelson Mandela,6,2004-12-1,2476
1879373564,Navajo Long Walk,128,1994-7-1,2477
553813536,The Devil in the White City: Murder  Magic and Madness at the Fair that Changed America,496,2004-4-1,2478
385602731,The Devil in the White City Murder  Magic  and Madness at the Fair That Changed America,447,2003-3-3,2479
394705122,The Historian's Craft: Reflections on the Nature and Uses of History and the Techniques and Methods of Those Who Write It.,224,1964-3-12,2480
1886363064,Charles Dickens as a Legal Historian,166,2010-2-1,2481
226348180,The Progressive Historians: Turner  Beard  Parrington (Phoenix Book),498,1979-11-19,2482
312182627,What Did the Constitution Mean to Early Americans? (Historians at Work),169,1999-1-1,2483
1415929017,The Historian,26,2005-12-13,2484
140004684X,See No Evil: The True Story of a Ground Soldier in the CIA's War on Terrorism,320,2003-1-7,2485
380794772,In a Dry Season (Inspector Banks  #10),480,2000-7-3,2486
975323113,Plants and Landscapes for Summer-Dry Climates of the San Francisco Bay Region,336,2004-5-1,2487
079227363X,In Focus: National Geographic Greatest Portraits,504,2004-10-1,2488
1584281405,Portrait Photographer's Handbook,128,2004-9-28,2489
749934425,Portrait in Death (In Death  #16),354,2005-12-1,2490
1584281340,Posing for Portrait Photography: A Head-To-Toe Guide,124,2004-7-1,2491
2266082655,Le Portrait de Dorian Gray,345,1998-6-4,2492
1842161903,The Portrait of Dorian Gray,51,1999-10-10,2493
393955680,The Picture of Dorian Gray,462,1988-1-1,2494
393927547,The Picture of Dorian Gray,517,2006-8-1,2495
192807293,The Picture of Dorian Gray,229,2006-11-1,2496
231121253,An Arab-Syrian Gentleman and Warrior in the Period of the Crusades: Memoirs of Usamah Ibn-Munqidh,265,2000-6-22,2497
486218430,Technical Manual and Dictionary of Classical Ballet,176,1982-6-1,2498
074326407X,The Ballet Companion: A Dancer's Guide to the Technique  Traditions  and Joys of Ballet,333,2005-10-11,2499
486296385,Ballet Class,48,1997-7-2,2500
688152023,NYC Ballet Workout,208,1997-1-13,2501
789460971,The Illustrated Book of Ballet Stories (with CD),64,2000-6-14,2502
448435365,Lara's Leap of Faith (The Royal Ballet School Diaries  #2),144,2005-1-13,2503
448437694,Isabelle's Perfect Performance (The Royal Ballet School Diaries  #3),144,2005-5-5,2504
1841482641,The Barefoot Book Of Ballet Stories,96,2004-9-1,2505
448442515,Boys or Ballet? (Royal Ballet School Diaries  #8),144,2006-8-3,2506
385033982,101 Stories of the Great Ballets: The Scene-by-Scene Stories of the Most Popular Ballets  Old and New,560,1975-5-20,2507
764525689,Ballet for Dummies,348,2003-10-3,2508
803729782,Time for Ballet,32,2004-3-30,2509
415942578,Ballet in Western Culture: A History of Its Origins and Evolution,368,2002-8-11,2510
044844013X,Angelina's Ballet Class,24,2006-1-19,2511
811856984,San Francisco Ballet at Seventy-Five,188,2007-11-12,2512
500203520,Ballet and Modern Dance,224,2002-6-17,2513
081301395X,Teaching Classical Ballet,200,1996-4-20,2514
970016409,Drat! We're Rats! (Scrambled Legs  #1),160,2000-9-1,2515
970016417,Battle of the Bunheads (Scrambled Legs  #2),160,2000-9-1,2516
590428888,Blubberina (Scrambled Legs  #5),135,1989-10-1,2517
811201082,The Books in My Life,327,1969-1-17,2518
440235162,The Smoke Jumper,576,2002-7-30,2519
9500717638,La casa de los espíritus,456,2000-9-1,2520
60086246,Last Chance Saloon,528,2003-5-27,2521
60731303,Anybody Out There? (Walsh Family  #4),456,2006-5-9,2522
99489988,Watermelon (Walsh Family  #1),520,2005-7-7,2523
60090383,Rachel's Holiday (Walsh Family  #2),578,2007-1-23,2524
60090375,Lucy Sullivan Is Getting Married,640,2007-1-23,2525
60787031,Essays and Stories by Marian Keyes: Bags  Trips  Make-up Tips  Charity  Glory  and the Darker Side of the Story,368,2005-9-6,2526
1902602323,No Dress Rehearsal,79,2000-12-1,2527
1421504618,Fullmetal Alchemist  Vol. 10,200,2006-11-21,2528
1421501759,Fullmetal Alchemist  Vol. 5 (Fullmetal Alchemist  #5),200,2006-1-10,2529
552995886,The House of the Spirits,491,1986-8-8,2530
1400043182,The House of the Spirits,488,2005-4-19,2531
1932206108,"How To Meditate: An Anthology Of Talks On Meditation And ""Meditation: The Bridge Is Flowing But The River Is Not""",228,2004-1-1,2532
1932206086,Insights: Talks On The Nature Of Existence,304,2003-1-1,2533
743285026,Palestine: Peace Not Apartheid,288,2006-11-30,2534
743285018,Our Endangered Values: America's Moral Crisis,224,2006-9-26,2535
743211995,An Hour Before Daylight: Memories of a Rural Boyhood,288,2001-10-16,2536
895260905,The Real Jimmy Carter: How Our Worst Ex-President Undermines American Foreign Policy  Coddles Dictators and Created the Party of Clinton and Kerry,272,2004-3-19,2537
345425928,The Virtues of Aging,160,1998-10-13,2538
812930347,Living Faith,288,1998-9-14,2539
743270681,Sharing Good Times,192,2005-11-7,2540
345479726,Until I Find You,820,2006-5-30,2541
525948929,Atlas Shrugged,1176,2005-4-21,2542
452286360,Atlas Shrugged,1192,2004-12-28,2543
451171926,Atlas Shrugged,1074,1992-3-3,2544
394415760,Atlas Shrugged,1168,1957-10-12,2545
1842430343,Skinny Legs and All,422,2002-3-10,2546
449910288,Fannie Flagg's Original Whistle Stop Cafe Cookbook,224,1995-9-11,2547
874776317,Free Play: Improvisation in Life and Art,224,1991-5-1,2548
039332690X,The Sari Shop,224,2005-6-17,2549
440241413,Confessions of a Shopaholic (Shopaholic  #1),368,2003-11-4,2550
044024191X,Shopaholic and Sister (Shopaholic  #4),388,2006-11-28,2551
440241812,Shopaholic Takes Manhattan (Shopaholic  #2),387,2004-12-27,2552
440241898,Shopaholic Ties the Knot (Shopaholic  #3),407,2004-8-31,2553
385338708,Shopaholic & Baby (Shopaholic  #5),359,2007-2-27,2554
552998877,The Secret Dreamworld of a Shopaholic (Shopaholic  #1),320,2000-9-14,2555
1573223204,The Story of Chicago May,307,2005-10-1,2556
252019814,Chicago Stories,296,1998-6-1,2557
811839745,Chicago Stories: Tales of the City,224,2003-2-1,2558
375757996,The Basic Works of Aristotle,1487,2009-8-19,2559
691019622,Fear and Trembling and The Sickness Unto Death,420,1968-11-21,2560
486406660,Selections from Don Quixote - Selecciones de Don Quijote de la Mancha,288,1998-12-23,2561
067942895X,The Complete Collected Poems,273,1994-9-13,2562
198245971,Hegel's Phenomenology of Spirit,640,1976-11-30,2563
691120528,Preface to the Phenomenology of Spirit,223,2005-1-17,2564
253209102,Hegel's Phenomenology of Spirit,176,1988-8-1,2565
872203492,Plato: Complete Works,1838,1997-5-1,2566
1559343567,A Guided Tour of 5 Works by Plato: Euthyphro/Apology/Crito/Phaedo/Cave,125,1995-12-28,2567
439474299,Midnight for Charlie Bone (The Children of the Red King  #1),401,2003-3-1,2568
080755538X,The Midnight Mystery (The Boxcar Children  #95),128,2003-1-1,2569
375752196,Within a Budding Grove (In Search of Lost Time  #2),749,1998-11-3,2570
687002826,Exclusion & Embrace: A Theological Exploration of Identity  Otherness  and Reconciliation,306,1996-12-1,2571
1595542329,A Time to Embrace (Timeless Love  #2),400,2006-10-29,2572
451200268,Devil's Embrace (Devil  #1),397,2000-5-1,2573
393308553,The Book of Embraces,288,1992-4-17,2574
768423481,Experiencing Father's Embrace,256,2006-4-1,2575
080282966X,A Time to Embrace: Same-Gender Relationships in Religion  Law  and Politics,330,2006-11-1,2576
671737694,Memory's Embrace (Corbins  #3),320,1991-6-1,2577
60957263,Beauty: The Invisible Embrace,261,2005-3-1,2578
349113009,Embrace,726,2001-2-1,2579
034546401X,Saving Fish from Drowning,472,2006-9-26,2580
840806701X,Un Lugar Llamado Nada,475,2006-8-30,2581
156032295,Virginia Woolf: An Inner Life,544,2006-11-6,2582
014101380X,Measure for Measure,224,2005-10-27,2583
618134301,Henry Adams and the Making of America,480,2005-9-14,2584
037571457X,Persepolis: The Story of a Childhood (Persepolis  #1),153,2004-6-1,2585
375714669,Persepolis 2: The Story of a Return (Persepolis  #2),187,2005-8-2,2586
375424156,Chicken with Plums,84,2006-10-3,2587
375714677,Embroideries,144,2006-4-18,2588
753820250,The Shadow of the Wind (The Cemetery of Forgotten Books  #1),520,2005-10-5,2589
078683787X,Peter and the Shadow Thieves (Peter and the Starcatchers  #2),557,2006-7-15,2590
765342405,Ender's Shadow (The Shadow Series  #1),469,2002-5-19,2591
812565959,Shadow of the Hegemon (The Shadow Series  #2),451,2001-12-9,2592
345453867,Shadow Dance (Buchanan-Renard  #6),336,2006-12-26,2593
812513738,The Shadow Rising (The Wheel of Time  #4),1007,1993-10-15,2594
1595550445,The Shadow Party: How George Soros  Hillary Clinton  and Sixties Radicals Seized Control of the Democratic Party,304,2006-8-6,2595
373802544,Cast in Shadow (Chronicles of Elantra  #1),507,2005-7-1,2596
62507540,Owning Your Own Shadow: Understanding the Dark Side of the Psyche,118,2009-6-9,2597
99283573,In Praise of Shadows,73,2001-5-3,2598
006062213X,Shadow of the Almighty: The Life and Testament of Jim Elliot,272,2009-9-29,2599
515135968,Shadow Game (GhostWalkers  #1),323,2003-8-26,2600
99448750,The Elephant Vanishes,327,2003-12-1,2601
99448475,Sputnik Sweetheart,229,2002-10-3,2602
60851899,Back to Wando Passo,448,2006-5-23,2603
184243022X,Still Life with Woodpecker,288,2001-4-9,2604
184243036X,Half Asleep in Frog Pajamas,389,2002-1-5,2605
553107755,Fierce Invalids Home from Hot Climates,415,2000-5-2,2606
3499156717,PanAroma: Jitterbug Perfume,556,1985-12-5,2607
3499154293,Ein Platz für Hot Dogs: Another Roadside Attraction,376,1997-6-1,2608
3499224429,Halbschlaf im Froschpyjama,459,1998-11-2,2609
385333471,God Bless You  Mr. Rosewater,288,1998-9-8,2610
385333811,Wampeters  Foma and Granfalloons,318,1999-1-12,2611
385334141,Mother Night,282,1999-5-11,2612
385333870,Galápagos,324,1999-1-12,2613
99267543,Timequake,219,1998-8-6,2614
385334230,Slapstick  or Lonesome No More!,288,1999-5-11,2615
743410580,Like Shaking Hands with God: A Conversation About Writing,80,2000-12-1,2616
385334265,Palm Sunday: An Autobiographical Collage,300,1999-5-11,2617
60263199,Sun  Moon  Star,62,1980-1-1,2618
051712436X,Cat's Cradle/God Bless You Mr. Rosewater/Breakfast of Champions,527,1995-5-28,2619
60544880,Bradbury Stories: 100 of His Most Celebrated Tales,912,2005-4-5,2620
61131547,Farewell Summer (Green Town  #3),211,2006-10-17,2621
553286374,Classic Stories 1: The Golden Apples of the Sun/R is for Rocket,348,1990-4-7,2622
380977265,Dandelion Wine,267,1999-2-1,2623
60859628,The Homecoming,56,2006-8-30,2624
1877741094,Zen in the Art of Writing: Essays on Creativity,176,1993-8-1,2625
553112449,Switch on the Night,40,2004-9-14,2626
743474767,The Best of Ray Bradbury,162,2012-6-21,2627
60545844,The Bradbury Chronicles: The Life of Ray Bradbury,384,2006-2-21,2628
60777338,The Cat's Pajamas,234,2005-7-26,2629
375415033,Essays,1369,2002-10-15,2630
143036351,Why I Write,120,2005-9-6,2631
156421178,Homage to Catalonia,232,1980-10-22,2632
141183721,Keep the Aspidistra Flying,277,2000-10-26,2633
156701766,The Orwell Reader: Fiction  Essays  and Reportage,480,1961-3-8,2634
679420258,If on a Winter's Night a Traveler,254,1993-6-1,2635
1585425001,Parachutes & Kisses,405,2006-8-3,2636
1585425249,Fear of Fifty: A Midlife Memoir,329,2006-9-7,2637
1585424994,How to Save Your Own Life: An Isadora Wing Novel,313,2006-7-6,2638
1585425494,Any Woman's Blues,362,2007-1-1,2639
1585425540,What Do Women Want?: Essays by Erica Jong,309,2007-5-10,2640
393324354,Fanny: Being the True History of the Adventures of Fanny Hackabout-Jones,512,2003-5-17,2641
440201047,Serenissima aka Shylock's Daughter,384,1988-3-1,2642
1559362154,Dogeaters,96,2002-12-1,2643
374528667,Crescent and Star: Turkey Between Two Worlds,272,2002-9-4,2644
140003468X,Love in the Time of Cholera,348,2003-10-5,2645
9500703203,El amor en los tiempos del cólera,451,1992-1-1,2646
826414753,Gabriel Garcia Marquez's Love in the Time of Cholera: A Reader's Guide,188,2003-4-10,2647
571224385,The Unbearable Lightness of Being,320,2009-10-27,2648
385468865,Obasan,320,1993-12-27,2649
765344955,Ender's Game Boxed Set: Ender's Game  Ender's Shadow  Shadow of the Hegemon,1296,2002-9-16,2650
812532570,Speaker for the Dead (Ender's Saga  #2),432,1987-2-15,2651
307237699,The Audacity of Hope: Thoughts on Reclaiming the American Dream,375,2006-10-17,2652
679746323,Mao: The Unknown Story,801,2006-11-14,2653
097607267X,The Art of War,328,2005-4-1,2654
60826584,Oracle Bones: A Journey Between China's Past and Present,512,2006-4-25,2655
7176155,Wild Swans: Three Daughters of China,666,2004-4-5,2656
446608475,The Wild Swans,464,2001-11-1,2657
486424588,Women in Love,416,2003-1-15,2658
99474123,Women Who Love Too Much,314,2004-9-2,2659
553381415,Men Who Hate Women and the Women Who Love Them: When Loving Hurts and You Don't Know Why,304,2002-1-2,2660
767902521,A Walk in the Woods: Rediscovering America on the Appalachian Trail,284,1999-5-4,2661
307279464,A Walk in the Woods: Rediscovering America on the Appalachian Trail,397,2006-12-26,2662
736411038,A Walk in the Woods (Stickerific),16,2001-1-23,2663
571219357,The Fortress of Solitude,528,2005-1-6,2664
1932806490,Fortress of Solitude / The Devil Genghis,128,2006-12-1,2665
330261568,Our Ancestors: The Cloven Viscount  The Baron in the Trees  The Non-Existent Knight,393,1980-12-31,2666
156260557,Difficult Loves,300,1985-9-23,2667
156659751,The Nonexistent Knight & The Cloven Viscount,272,1977-3-28,2668
1400042828,The View from Castle Rock,349,2006-11-7,2669
771065264,The View From Castle Rock,368,2008-11-19,2670
037575931X,Crossing to Safety,368,2002-4-9,2671
525477624,Oh Rats! The Story of Rats and People,48,2006-8-17,2672
385333765,King Rat (Asian Saga  #4),368,2009-5-19,2673
60837160,Rat Bastards: The Life and Times of South Boston's Most Honorable Irish Mobster,304,2006-3-14,2674
375700986,Julius Knipl  Real Estate Photographer: The Beauty Supply District,120,2003-8-12,2675
1400102952,Blind Willow  Sleeping Woman: 24 Stories,0,2006-10-15,2676
1400044618,Blind Willow  Sleeping Woman,333,2006-8-29,2677
316159417,The Bookseller of Kabul,288,2004-10-26,2678
807831093,Jasmine and Stars: Reading More Than Lolita in Tehran,174,2007-3-5,2679
393061221,Making Globalization Work,384,2006-9-17,2680
081297235X,Prep : A Novel,420,2005-11-22,2681
8426415164,Tan fuerte  tan cerca,457,2005-9-30,2682
851703003,The Wizard of Oz,69,1992-5-27,2683
312254997,The Ground Beneath Her Feet,576,2000-3-16,2684
009959241X,The Moor's Last Sigh,434,1996-7-4,2685
8497598369,Los Versos Satánicos,679,2003-8-30,2686
140189351,Dangling Man,191,1996-10-1,2687
812969995,Grimus,320,2003-9-30,2688
140274111,Breakfast at Tiffany's,157,1998-9-3,2689
041377242X,Jesus' Son,192,2007-1-23,2690
99440830,Angels,209,2003-3-6,2691
60926961,The Throne of the Third Heaven of the Nations Millennium General Assembly: Poems Collected and New,225,1996-1-1,2692
60976101,The Stars at Noon,192,2000-5-30,2693
067978148X,The Rules of Attraction,283,1998-6-30,2694
375703845,Glamorama,546,2000-3-21,2695
679781498,Less Than Zero,208,2010-6-9,2696
375837892,A Christmas Memory,48,2006-10-10,2697
375507906,In Cold Blood,343,2002-3-5,2698
1581821360,The Southern Haunting of Truman Capote,135,2000-10-1,2699
812975936,Summer Crossing,142,2006-9-28,2700
141185937,Answered Prayers,192,2001-10-25,2701
679745572,The Grass Harp  Including A Tree of Night and Other Stories,272,1993-9-28,2702
962088110,From Babylon to Timbuktu: A History of the Ancient Black Races Including the Black Hebrews,151,2006-8-25,2703
792274571,Cruelest Journey: Six Hundred Miles To Timbuktu,320,2004-11-1,2704
385280793,Between Time and Timbuktu or Prometheus-5,304,1972-7-15,2705
1594201080,Murder in Amsterdam: The Death of Theo van Gogh and the Limits of Tolerance,288,2006-9-7,2706
99468387,The Cement Garden,144,2004-8-5,2707
99429799,Atonement,372,2002-5-2,2708
879074493,Gertrud The Great Of Helfta: Spiritual Exercises,165,1989-11-1,2709
3518373900,Gertrud,180,1983-1-1,2710
805232117,Der Prozess,0,1988-5-5,2711
3442730503,Naokos Lächeln,416,2003-2-1,2712
375726527,The Ruined Map,304,2001-12-4,2713
375726535,The Face of Another,238,2003-2-4,2714
231082819,Three Plays: Involuntary Homicide / The Green Stockings / The Ghost is Here,233,1997-3-1,2715
375726543,Secret Rendezvous,192,2002-7-9,2716
965913228,Oracle Night,245,2003-12-2,2717
1582346437,Eleanor Rigby,272,2006-5-30,2718
156421356,Homo Faber,228,1994-5-1,2719
3804417833,Erläuterungen Zu Max Frisch  Homo Faber,104,2002-5-11,2720
3458340440,Homo faber: Ein Bericht.,298,1995-1-1,2721
1400076323,The Philosophy of Jean-Paul Sartre,512,2003-5-27,2722
415278481,Being and Nothingness,688,2003-8-28,2723
679738959,The Age of Reason,408,1992-7-7,2724
3492207006,Die Entdeckung der Langsamkeit,358,1999-3-28,2725
385481969,Youth in Revolt: The Journals of Nick Twisp,512,2001-1-1,2726
449911411,And I Don't Want to Live This Life: A Mother's Story of Her Daughter's Murder,408,1996-9-29,2727
571145450,Sid and Nancy: Love Kills,143,1986-12-31,2728
553384155,Flags of Our Fathers,382,2006-8-29,2729
440229200,Flags of Our Fathers: A Young People's Edition,224,2006-8-1,2730
1594481938,A Long Way Down,368,2006-5-2,2731
185549695X,Clockwork (Cover to Cover),0,2002-7-29,2732
038531129X,Mary Queen of Scots,568,1993-9-1,2733
712664564,Mary Queen of Scots and the Murder of Lord Darnley,640,2004-2-5,2734
946487502,On the Trail of Mary  Queen of Scots,192,1999-6-1,2735
886778441,River of Blue Fire (Otherland  #2),675,1999-9-1,2736
439194040,Mary  Queen of Scots: Queen Without a Country,202,2002-5-1,2737
886779065,Mountain of Black Glass (Otherland  #3),749,2000-9-12,2738
1860645887,Mary  Queen of Scots: Pride  Passion and a Kingdom Lost,224,2001-5-4,2739
618254110,Queen of Scots: The True Life of Mary Stuart,581,2004-4-7,2740
312352182,The Last Wife of Henry VIII,326,2006-10-3,2741
345407865,The Children of Henry VIII,385,1997-7-8,2742
60837330,The Last Days of Henry VIII,368,2005-9-20,2743
312194390,The Autobiography of Henry VIII: With Notes by His Fool  Will Somers,939,1998-9-15,2744
140714758,Henry VIII (Shakespeare  Pelican),126,2001-8-1,2745
330353829,The Memoirs of Cleopatra,1139,1998-1-10,2746
316367958,Saint George and the Dragon,32,1990-9-4,2747
312337078,Kiss Me Like a Stranger: My Search for Love and Art,261,2006-3-7,2748
3499222507,Wie ich eines schönen Morgens im April das 100%ige Mädchen sah,218,1998-8-1,2749
1593080344,The Complete Sherlock Holmes  Volume I,709,2003-9-1,2750
1593080409,The Complete Sherlock Holmes  Volume II,709,2003-10-1,2751
312425945,The Last of Her Kind,391,2006-12-12,2752
449908976,Anatomy of Love: A Natural History of Mating  Marriage  and Why We Stray,432,1994-1-3,2753
189491712X,The Devil's in the Details (A Camilla MacPhee Mystery  #4),320,2004-10-1,2754
1565117727,Wigfield: The Can-Do Town That Just May Not,5,2004-5-19,2755
822216310,The SantaLand Diaries and Season's Greetings,54,1998-12-1,2756
312306180,Jenny and the Jaws of Life: Short Stories,272,2002-9-14,2757
156002167,View With a Grain of Sand: Selected Poems,214,1995-5-26,2759
571191630,View with a Grain of Sand: Selected Poems,214,1996-10-23,2760
156011468,Poems New and Collected,296,2000-11-16,2761
691013802,Sounds  Feelings  Thoughts:  Seventy Poems by Wislawa Szymborska,232,1981-8-21,2762
393323854,Miracle Fair: Selected Poems,159,2002-11-17,2763
142437204,Jane Eyre,532,2003-2-4,2764
517333414,The Far Pavilions,0,1988-12-12,2765
312263104,Death in Kashmir,256,2000-12-1,2766
312049994,The Sun in the Morning: My Early Years in India and England,454,1990-9-1,2767
312252811,Death in the Andamans,272,2000-2-11,2768
312263082,Death in Berlin,272,2000-6-8,2769
031215125X,The Far Pavilions,958,1997-1-15,2770
312265816,Enchanted Evening,368,2000-12-5,2771
520243269,Pathologies of Power: Health  Human Rights and the New War on the Poor,438,2004-11-22,2772
520229134,Infections and Inequalities: The Modern Plagues,424,2001-2-23,2773
812973011,Mountains Beyond Mountains: The Quest of Dr. Paul Farmer  a Man Who Would Cure the World,333,2004-8-31,2774
1570625190,The Tao of Physics: An Exploration of the Parallels between Modern Physics and Eastern Mysticism,366,2000-1-4,2775
977795306,Dr. Mary's Monkey: How the Unsolved Murder of a Doctor  a Secret Laboratory in New Orleans and Cancer-Causing Monkey Viruses are Linked to Lee Harvey Oswald  the JFK Assassination and Emerging Global Epidemics,374,2007-4-1,2776
2884490477,The Art of Richard P. Feynman,174,1995-7-1,2777
080283972X,The Early History of God: Yahweh and the Other Deities in Ancient Israel,243,2002-8-28,2778
520213688,Haiti  History  and the Gods,362,1998-3-10,2779
195309685,Acts of God: The Unnatural History of Natural Disaster in America,309,2006-6-1,2780
62508113,The World's Religions,416,1991-9-13,2781
800637143,Introduction to World Religions,495,2005-3-24,2782
