isbn,title,num_pages,publication_date,book_id
826514707,Cervantes in Algiers: A Captive's Tale,368,2005-6-1,6075
786647973,Deluxe Encyclopedia of Mandolin Chords,72,2000-3-1,6076
596527411,CSS Cookbook,516,2006-10-24,6077
375822976,Big Dog... Little Dog,48,2003-5-27,6078
394800273,Snow,72,1962-10-12,6079
375802436,Flap Your Wings,48,2000-1-25,6080
1713191,Sam And The Firefly (Beginner Books),64,1985-6-17,6081
9027712050,The Berlin Phenomenology,210,1981-5-31,6082
486201120,The Philosophy of History,457,1956-6-1,6083
486445631,Philosophy of Right,272,2005-9-20,6084
1890159190,The Mistress Manual: The Good Girl's Guide to Female Dominance,220,2000-6-15,6085
743281594,Diary of a Mistress,182,2006-8-1,6086
1590171039,Mistress Masham's Repose,260,2012-3-7,6087
370006542,The Last Unicorn,224,1968-8-1,6088
345254848,The Last Unicorn,248,1969-1-1,6089
446606235,The Barbed Coil,667,1999-4-1,6090
3404204077,Melliandra,734,2001-3-1,6091
1421507196,Yakitate!! Japan  Volume 1,208,2006-9-12,6092
142150720X,Yakitate!! Japan  Volume 2,208,2006-11-14,6093
1421507218,Yakitate!! Japan  Volume 3,208,2007-1-9,6094
1421509210,Yakitate!! Japan  Volume 4,208,2007-3-13,6095
1421509245,Yakitate!! Japan  Volume 7,185,2007-9-11,6096
1421509229,Yakitate!! Japan  Volume 5,208,2007-5-8,6097
1421509237,Yakitate!! Japan  Volume 6,185,2007-7-10,6098
4091263992,焼きたて!!ジャぱん 9 [Yakitate!! Japan 9],190,2003-10-18,6099
786914297,Brothers in Arms (Dragonlance: Raistlin Chronicles  #2),476,1999-8-1,6100
044667284X,A Magic-Lover's Treasury of the Fantastic,421,1998-1-1,6101
078693669X,Dragons in the Archives: The Best of Weis & Hickman (Dragonlance Anthology),374,2004-11-1,6102
61020583,Guardians of the Lost (Sovereign Stone  #2),652,2002-9-3,6103
786937777,The War of the Lance (DragonLance: Tales II  #3),343,2005-12-1,6104
786904917,The Dragons at War (Dragonlance Dragons  #2),339,1996-5-1,6105
886778573,Earth  Air  Fire  Water (Tales from the Eternal Archives  #2),320,1999-11-1,6106
786931582,Time of the Twins (Dragonlance: Legends  #1),389,2004-3-1,6107
770429912,A Certain Justice (Adam Dalgliesh  #10),688,2006-3-28,6108
451217764,A Certain Justice (Abe Glitsky  #1),624,2006-2-7,6109
1573225789,The Color of Water: A Black Man's Tribute to His White Mother,291,2004-1-14,6110
226142698,Lost Prophet: The Life and Times of Bayard Rustin,592,2004-10-1,6111
1931615039,Answers to Questions Teachers Ask about Sensory Integration: Forms  Checklists  and Practical Tools for Teachers and Parents,63,2002-1-1,6112
688153879,Kevin Trudeau's Mega Memory: How to Release Your Superpower Memory in 30 Minutes Or Less a Day,368,2005-8-16,6113
1573228710,Still Here: Embracing Aging  Changing and Dying,224,2001-6-1,6114
1400054036,Paths to God: Living the Bhagavad Gita,352,2005-10-25,6115
1401910440,Here We All Are,0,2005-12-15,6116
517543052,Be Here Now,416,1971-10-12,6117
385084137,The Only Dance There Is,192,1974-3-5,6118
553285726,Journey of Awakening: A Meditator's Guidebook,448,1990-7-1,6119
1593976720,A Spiritual Journey,0,2005-8-1,6120
940687569,Finding and Exploring Your Spiritual Path: An Exploration of the Pleasures and Perils of Seeking Personal Enlightenment,0,1989-5-15,6121
067005934X,Make Way for McCloskey,144,2004-10-21,6122
014050978X,Burt Dow  Deep-Water Man,64,1989-3-1,6123
140502874,Lentil,64,1978-4-27,6124
140502017,Time of Wonder,64,1985-6-15,6125
074755904X,Riddley Walker,236,2010-2-1,6126
395746566,Sector 7,48,1999-9-20,6127
671646192,Wind Child,331,1990-7-1,6128
60765402,The Catswold Portal,432,2005-1-25,6129
61015628,Cat Laughing Last (Joe Grey  #7),368,2002-11-5,6130
006101561X,Cat Seeing Double (Joe Grey  #8),384,2003-10-28,6131
802141242,Charlie Wilson's War: The Extraordinary Story of How the Wildest Man in Congress and a Rogue CIA Agent Changed the History of our Times,560,2004-4-22,6132
786179953,Charlie Wilson's War: The Extraordinary Story of the Largest Covert Operation in History,10,2005-10-1,6133
613998057,Charlie Wilson's War: The Extraordinary Story of the Largest Cover Operation in History,550,2004-4-22,6134
1844130800,The Fourth Crusade: And the Sack of Constantinople,416,2005-4-7,6135
052143971X,Practical Ethics,411,1993-1-29,6136
60011572,Animal Liberation,352,2001-12-1,6137
075093400X,Boudicca: The Warrior Queen,250,2005-2-1,6138
316787531,Our Band Could Be Your Life: Scenes from the American Indie Underground  1981-1991,522,2002-7-2,6139
441014348,Cursor's Fury (Codex Alera  #3),442,2006-12-5,6140
60530480,Sharpe's Fury (Sharpe  #11),352,2006-8-22,6141
044101268X,Furies of Calderon (Codex Alera  #1),504,2005-6-28,6142
080242855X,Your Child and Jesus: A Family Activity Book,112,1999-9-13,6143
1852423285,To the Friend who Didn't Save my Life,240,1998-1-1,6144
670038385,The Mistress's Daughter,256,2007-4-5,6145
802141684,Layer Cake,344,2004-8-31,6146
670034665,Self-Made Man: One Woman's Journey Into Manhood and Back Again,290,2006-1-19,6147
618134328,Nixon Agonistes: The Crisis of the Self-Made Man,640,2002-11-14,6148
470861711,The Man Who Changed Everything: The Life of James Clerk Maxwell,256,2004-10-15,6149
452267455,Baghdad Without a Map and Other Misadventures in Arabia,285,1992-1-1,6150
446602485,Night Train to Memphis (Vicky Bliss  #5),368,1995-12-1,6151
495006858,Sociology in Our Times,742,2006-1-1,6152
394429826,Iberia: Spanish Travels and Reflections,818,1968-4-12,6153
449218473,Journey,336,1994-10-1,6154
439297710,You Remind Me of You: A Poetry Memoir,128,2002-2-1,6155
61140538,Remind Me Again Why I Need A Man,384,2007-5-1,6156
425212017,Strange Candy (Anita Blake  Vampire Hunter #0.5),257,2006-10-3,6157
1592402739,Candy Girl: A Year in the Life of an Unlikely Stripper,212,2007-1-2,6158
345486471,Candy Licker,304,2005-12-27,6159
345423879,Candy,304,1998-6-16,6160
1596321288,Hard Candy,350,2005-6-30,6161
316563560,Candy,279,2003-7-15,6162
1591821541,Demon Diary  Volume 01,192,2003-5-6,6163
1591821568,Demon Diary  Volume 03,187,2003-9-9,6164
159182155X,Demon Diary  Volume 02,199,2003-7-8,6165
1591821576,Demon Diary  Volume 04,192,2003-11-4,6166
393327655,The End of Faith: Religion  Terror  and the Future of Reason,348,2005-9-17,6167
038541580X,Prisoner's Dilemma: John von Neumann  Game Theory  and the Puzzle of the Bomb,320,1993-1-1,6168
486226689,Lost Continents,363,1970-6-1,6169
1600961509,The Lost Continent,108,2008-7-30,6170
803273320,The Lost Continent: The Story of Atlantis,260,2002-11-1,6171
767911792,Conspiracy of Fools,784,2005-12-27,6172
039471699X,The Death and Rebirth of the Seneca,416,1972-4-12,6173
1591822203,Rebirth Volume 5,184,2003-12-2,6174
971357234,Satan Burger,230,2001-11-1,6175
842366652,The Strategy of Satan: How to Detect and Defeat Him,162,1979-7-20,6176
679813462,The Black Stallion and Satan (The Black Stallion  #5),224,1992-4-14,6177
059514506X,Satan: His Psychotherapy and Cure by the Unfortunate Dr. Kassler  J.S.P.S.,496,2000-11-1,6178
1416543007,Everyone Worth Knowing,448,2006-12-26,6179
446697389,The Lost Blogs: From Jesus to Jim Morrison--The Historically Inaccurate and Totally  Fictitious Cyber Diaries of Everyone Worth Knowing,288,2009-11-29,6180
515110752,Happy Are the Peace Makers (Blackie Ryan  #5),300,1993-4-1,6181
465045855,The Truth Will Set You Free: Overcoming Emotional Blindness and Finding Your True Adult Self,224,2002-12-10,6182
1860467210,The Stone Raft,272,2000-6-1,6183
1860469019,Baltasar and Blimunda,346,2001-9-20,6184
60765313,You: The Owner's Manual: An Insider's Guide to the Body That Will Make You Healthier and Younger,417,2005-1-1,6185
743292545,You: On a Diet: The Owner's Manual for Waist Management,370,2006-10-31,6186
553803719,Foundation (Foundation  #1),244,2004-6-1,6187
553803735,Second Foundation (Foundation #3),256,2004-6-1,6188
553803727,Foundation and Empire (Foundation #2),256,2004-6-1,6189
553587579,Foundation and Earth (Foundation #5),500,2004-8-31,6190
838526950,Foundations of Clinical Research: Applications to Practice,742,2000-1-1,6191
076530953X,Down and Out in the Magic Kingdom,208,2003-12-5,6192
765312808,Someone Comes to Town  Someone Leaves Town,315,2006-5-30,6193
765310457,Eastern Standard Tribe,223,2005-4-1,6194
1568582862,A Place So Foreign and Eight More,243,2003-9-8,6195
785209824,Through Painted Deserts: Light  God  and Beauty on the Open Road,256,2005-8-14,6196
751370738,20 000 Leagues Under the Sea,64,1998-10-8,6197
451209796,Codebreakers' Victory: How the Allied Cryptographers Won World War II,352,2003-11-4,6198
399153055,All Night Long,416,2006-1-3,6199
039915373X,White Lies (Arcane Society  #2),371,2007-2-1,6200
515141402,Ghost Hunter (Ghost Hunters  #3),327,2006-5-30,6201
373771711,The Pirate / The Adventurer / The Cowboy,362,2006-4-25,6202
446692476,Midnight Jewels,425,2003-7-1,6203
1551668513,The Wedding Night,256,2001-11-23,6204
515136948,After Glow (Ghost Hunters  #2),343,2004-2-24,6205
671569023,Orchid (St. Helen's  #3),327,1998-5-1,6206
713912545,The Origin of Consciousness in the Breakdown of the Bicameral Mind,467,1979-6-1,6207
1852339462,The Future of the Universe,175,2006-12-1,6208
963281437,Micro Eco-Farming: Prospering from Backyard to Small Acreage in Partnership with the Earth,174,2005-5-1,6209
014024350X,The Quiet American: Text and Criticism,515,1996-1-1,6210
99478390,The Quiet American,198,2004-10-7,6211
99478447,The End of the Affair,160,2004-10-7,6212
143037757,Postwar: A History of Europe Since 1945,933,2006-9-5,6213
1578068894,The Coen Brothers: Interviews,208,2006-8-18,6214
830828265,The Hermeneutical Spiral: A Comprehensive Introduction to Biblical Interpretation,624,2006-12-1,6215
082543632X,Raising the Bar: Ministry to Youth in the New Millennium,208,2004-4-7,6216
143038184,The Book of Other People,304,2008-1-2,6217
142180009,The Confusions of Young Törless,176,2001-9-27,6218
192100335,Robinson Crusoe,306,1999-9-16,6219
674215184,Doubling the Point: Essays and Interviews,438,1992-8-12,6220
698118758,Fantastic! Wow! and Unreal!: A Book About Interjections and Conjunctions,32,2000-10-23,6221
826414745,Don DeLillo's White Noise: A Reader's Guide,96,2003-4-10,6222
679764178,Letting Go,630,1997-9-2,6223
067974827X,My Life as a Man,334,1994-1-13,6224
679752935,Patrimony,240,1996-6-3,6225
679749063,The Great American Novel,416,1995-4-11,6226
99389010,The Professor of Desire,272,1995-10-5,6227
99801906,Deception,208,2006-1-17,6228
679759255,When She Was Good,320,1995-1-31,6229
99422697,The Dying Animal,156,2002-3-7,6230
375704434,For the Relief of Unbearable Urges,205,2000-3-21,6231
375404937,The Ministry of Special Cases,339,2007-4-24,6232
486426750,The Pilgrim's Progress,324,2003-2-10,6233
1932664084,Scott Pilgrim  Volume 1: Scott Pilgrim's Precious Little Life,168,2004-8-18,6234
802806414,The Pilgrim's Regress,219,1992-1-10,6235
802449247,Little Pilgrim's Progress: From John Bunyan's Classic,336,2006-2-1,6236
394846974,The Landing of the Pilgrims,160,1981-2-12,6237
802449263,Little Pilgrim's Progress,256,1989-3-8,6238
1566993237,From Nomads to Pilgrims: Stories from Practicing Congregations,179,2005-12-30,6239
312313675,The New York Times Guide to Essential Knowledge,1104,2004-11-5,6240
1580931774,New York 2000: Architecture and Urbanism Between the Bicentennial and the Millennium,1520,2006-11-1,6241
60754001,Forgotten New York: Views of a Lost Metropolis,384,2006-9-26,6242
805078428,The Historical Atlas of New York City: A Visual Celebration of Nearly 400 Years of New York City's History,192,2005-7-1,6243
221102288X,La toile de Charlotte,192,1997-4-1,6244
789308843,This Is New York,64,2003-5-30,6245
155652482X,They Dare to Speak Out: People and Institutions Confront Israel's Lobby,416,2003-5-1,6246
057120905X,Famous Last Words,416,2001-8-20,6247
571207995,The Wars,218,2001-8-20,6248
1560761547,Into the Void (Spelljammer: The Cloakmaster Cycle  #2),311,1991-9-1,6249
159308269X,Essential Dialogues of Plato,624,2005-10-5,6250
691097186,The Collected Dialogues,1776,1963-9-15,6251
1593080972,Republic,496,2005-8-1,6252
460873822,The Republic,240,1993-11-15,6253
156280135X,Inner Circle (Carol Ashton Mysteries  #8),196,1996-10-1,6254
034546141X,The Rising Tide (World War II: 1939-1945  #1),576,2006-11-7,6255
345464885,Jeff Shaara's Civil War Battlefields: Discovering America's Hallowed Ground,288,2006-4-25,6256
345427548,Rise to Rebellion,492,2004-6-29,6257
345427513,Gone for Soldiers: A Novel of the Mexican War,424,2001-7-3,6258
345434811,The Last Full Measure (The Civil War Trilogy  #3),640,2000-5-2,6259
719071151,A Farewell to Arms?: Beyond the Good Friday Agreement,624,2006-4-18,6260
465015220,When Smoke Ran Like Water: Tales Of Environmental Deception And The Battle Against Pollution,352,2003-12-25,6261
679740589,What Work Is,77,1992-4-21,6262
679765840,The Simple Truth,69,1996-9-3,6263
60976098,Fiskadoro,221,2000-5-30,6264
99427869,Illusions: The Adventures of a Reluctant Messiah,144,2001-3-12,6265
385319274,There's No Such Place As Far Away,48,1998-1-12,6266
385315287,Running from Safety: An Adventure of the Spirit,368,1995-11-1,6267
330304216,A Gift Of Wings,299,2001-5-11,6268
449702022,Winter of Magic's Return,194,1986-11-12,6269
141441127,A Modern Utopia,320,2006-3-31,6270
786407808,The War of the Worlds,321,2001-4-30,6271
141441046,The Shape of Things to Come,530,2006-5-26,6272
972851720,Floor Games (Sandplay Classics),110,2004-9-1,6273
706425618,Seven Novels,828,1985-1-1,6274
844631515,Three Prophetic Science Fiction Novels,335,1975-12-31,6275
517436329,Science Fiction Treasury: Six Complete Novels (complete & unabridged),688,1984-9-19,6276
553214322,The Island of Doctor Moreau,153,1994-5-1,6277
195108965,Notebooks of the Mind: Explorations of Thinking  Revised Edition,288,1997-1-23,6278
674940520,The Visible Hand: The Managerial Revolution in American Business,624,1977-1-1,6279
1931082006,Crime Stories and Other Writings,934,2001-9-10,6280
752865331,The Maltese Falcon,213,2005-3-1,6281
972589813,Lost Stories,342,2005-9-1,6282
752851802,The Dain Curse,256,2002-12-5,6283
679722599,The Big Knockover: Selected Stories and Short Novels,480,1989-7-17,6284
752852612,Red Harvest,224,2003-5-1,6285
038541627X,The Complete Stories  Vol 1,624,1990-10-1,6286
2290315524,Xénocide (Ender's Saga  #3),573,2001-10-18,6287
60923318,Edgar A. Poe: Mournful and Never-ending Remembrance,592,2008-12-23,6288
689848374,Tales of Mystery and Madness,135,2011-8-30,6289
441203981,Elric of Melniboné (The Elric Saga  #1),181,1987-7-15,6290
778320898,The Prize (deWarenne Dynasty  #4),575,2004-9-24,6291
1905850581,Elric of Melnibone: Bright Shadows,98,2008-4-1,6292
226500667,A River Runs Through it and Other Stories,217,2001-10-1,6293
226500624,Young Men and Fire,301,1993-11-5,6294
807085731,When the Rivers Run Dry: Water - The Defining Crisis of the Twenty-first Century,336,2007-3-15,6295
801489784,The River Runs Black: The Environmental Challenge to China's Future,337,2005-2-24,6296
785263780,Only the River Runs Free (The Galway Chronicles  #1),271,1997-1-14,6297
224060872,It's Not About the Bike: My Journey Back to Life,294,2001-5-3,6298
158240612X,The Walking Dead  Vol. 5: The Best Defense,136,2009-4-21,6299
1401359345,Being Dead Is No Excuse: The Official Southern Ladies Guide to Hosting the Perfect Funeral,243,2005-3-16,6300
345486587,Drop Dead Gorgeous (Blair Mallory  #2),347,2006-11-28,6301
1582404879,The Walking Dead  Vol. 3: Safety Behind Bars,136,2005-6-18,6303
1582406197,The Walking Dead  Book One (The Walking Dead #1-12),304,2010-10-5,6304
1400095956,The Brief History of the Dead,252,2007-1-9,6305
1930692471,Beckett Football Card Price Guide,830,2006-9-1,6306
1401917178,The Power of Infinite Love & Gratitude: An Evolutionary Journey to Awakening Your Spirit,298,2007-2-1,6307
520215109,Masculinity and Male Codes of Honor in Modern France,316,1998-11-30,6308
349102503,The Life and Death of My Lord Gilles de Rais,323,1991-12-1,6309
446617458,The White Wolf's Son: The Albino Underground (Elric & Oona Von Bek  #3),432,2006-9-1,6310
1563895161,Michael Moorcock's Multiverse,288,1999-11-1,6311
446691402,Gloriana,496,2004-8-1,6312
1565041917,The Eternal Champion (Eternal Champion  #1),484,1996-2-1,6313
140286373,The Spell,272,2000-5-1,6314
679722564,The Swimming-Pool Library,352,1989-9-19,6315
1590170784,The Ivory Tower,296,2004-2-29,6316
895260786,America Alone: The End of the World As We Know It,224,2006-10-1,6317
60572345,Where the Sidewalk Ends: Poems and Drawings,192,2014-2-18,6318
60513063,A Light in the Attic,176,2002-10-7,6319
60256710,The Missing Piece (The Missing Piece  #1),112,2006-1-24,6320
60256575,The Missing Piece Meets the Big O,104,2006-1-24,6321
60256753,Lafcadio  the Lion Who Shot Back,112,2013-9-24,6322
66236177,A Light in the Attic (Book & CD),176,2001-10-9,6323
61130478,Runny Babbit Book and Abridged CD,96,2006-9-26,6324
887782719X,L'albero,62,2000-5-1,6325
425205517,The Beginning: The Cove / The Maze (FBI Thriller #1-2),544,2005-9-6,6326
451206126,Jade Star (Star  #4),400,2002-6-1,6327
399154248,Double Take (FBI Thriller  #11),420,2007-6-12,6328
515118362,The Valentine Legacy (Legacy #3),406,1996-9-1,6329
1597221104,Undead and Unwed (Undead  #1),392,2005-12-31,6330
1597221287,Undead and Unappreciated (Undead  #3),279,2005-12-31,6331
312360266,Marked (House of Night  #1),306,2007-5-1,6332
037380251X,Divine By Choice (Partholon  #2),377,2006-11-21,6333
373802471,Divine By Mistake (Partholon  #1),701,2006-8-29,6334
373802447,Cast in Courtlight (Chronicles of Elantra  #2),488,2006-7-18,6335
425201961,Goddess of Light (Goddess Summoning  #3),355,2005-4-5,6336
373802420,Brighid's Quest (Partholon  #5),507,2005-11-29,6337
425208915,Goddess of the Rose (Goddess Summoning  #4),345,2006-2-7,6338
425197492,Goddess of Spring (Goddess Summoning  #2),360,2004-8-3,6339
425192792,Goddess of the Sea (Goddess Summoning  #1),368,2003-10-7,6340
425211061,Mysteria (Mysteria  #1),340,2006-7-5,6341
373802137,Elphame's Choice (Partholon  #4),551,2004-11-24,6342
1401210619,Loveless  Vol. 1: A Kin of Homecoming,128,2006-5-1,6343
312339011,Where the Mountain Casts Its Shadow: The Dark Side of Extreme Adventure,256,2005-4-1,6344
445405562,Cast a Yellow Shadow (Mac McCorkle  #2),272,1987-2-1,6345
1560971169,Like a Velvet Glove Cast in Iron,200,1993-1-17,6346
425215288,Goddess of Love (Goddess Summoning  #5),292,2007-6-5,6347
345443586,Mistral's Kiss (Merry Gentry  #5),212,2006-12-12,6348
425217248,The Harlequin (Anita Blake  Vampire Hunter #15),422,2007-6-5,6349
345443608,A Stroke of Midnight (Merry Gentry  #4),385,2006-11-28,6350
425207978,Danse Macabre (Anita Blake  Vampire Hunter  #14),483,2006-6-27,6351
515140872,Micah (Anita Blake  Vampire Hunter  #13),245,2006-3-1,6352
786941227,Death of a Darklord (Ravenloft #13),306,2006-7-11,6353
515136174,Anita Blake  Vampire Hunter Collection 1-4 (Anita Blake  Vampire Hunter  #1-4),1256,2003-2-25,6354
1569709068,Little Butterfly  Volume 02,170,2006-9-19,6355
156970905X,Little Butterfly  Volume 03,184,2006-12-6,6356
1569709076,Little Butterfly  Volume 01,184,2006-5-30,6357
679888098,The Little Butterfly,24,1998-4-14,6358
345478169,A Caress of Twilight (Merry Gentry  #2),348,2005-3-15,6359
425205673,Bloody Bones (Anita Blake  Vampire Hunter #5),336,2005-11-1,6360
515134473,Burnt Offerings (Anita Blake  Vampire Hunter  #7),392,2002-9-24,6361
553816322,Seduced by Moonlight (Merry Gentry  #3),409,2005-1-14,6362
425209067,The Killing Dance (Anita Blake  Vampire Hunter  #6),368,2006-4-4,6363
515136816,Cerulean Sins (Anita Blake  Vampire Hunter  #11),529,2004-8-31,6364
515134457,Blue Moon (Anita Blake  Vampire Hunter  #8),418,2002-9-24,6365
031235360X,A Stolen Season (Alex McKnight  #7),304,2006-9-5,6366
515133876,Narcissus in Chains (Anita Blake  Vampire Hunter  #10),644,2002-9-24,6367
1421505606,Sensual Phrase  Vol. 15,175,2006-8-1,6368
1421505622,Sensual Phrase  Vol. 17,208,2006-12-1,6369
1591164494,Sensual Phrase  Vol. 3,192,2004-8-11,6370
71391401,Harrison's Principles of Internal Medicine,2751,2004-7-27,6371
60788380,For a Few Demons More (The Hollows  #5),456,2007-3-20,6372
60788194,A Fistful of Charms (The Hollows  #4),510,2006-6-27,6373
60572973,The Good  the Bad  and the Undead (The Hollows  #2),453,2005-1-25,6374
006057299X,Every Which Way But Dead (The Hollows  #3),501,2005-6-28,6375
60572965,Dead Witch Walking (The Hollows  #1),416,2004-7-1,6376
006085409X,Dates from Hell,416,2006-3-28,6377
60898720,Pacto Con un Demonio,512,2008-7-1,6378
515139750,Incubus Dreams (Anita Blake  Vampire Hunter  #12),722,2005-9-27,6379
3442356911,Schattenkuss (Meredith Gentry  #1),573,2002-4-2,6380
425201376,The Lunatic Cafe (Anita Blake  Vampire Hunter #4),352,2005-3-1,6381
425201392,Circus of the Damned (Anita Blake  Vampire Hunter  #3),320,2007-1-2,6382
515131091,Out of this World,357,2001-8-1,6384
425197549,Guilty Pleasures (Anita Blake  Vampire Hunter  #1),355,2004-8-3,6385
3442358957,Nachtschwärmer (Meredith Gentry  #2),586,2003-5-1,6387
785127232,Laurell K. Hamilton's Anita Blake  Vampire Hunter: Guilty Pleasures vol 1,168,2007-7-18,6388
140449140,The Republic,416,2003-2-25,6389
465069347,The Republic of Plato,487,1991-10-3,6390
872206335,Five Dialogues: Euthyphro  Apology  Crito  Meno  Phaedo,156,2002-10-1,6391
60931361,Plato  Not Prozac!: Applying Eternal Wisdom to Everyday Problems,320,2000-8-1,6392
872207366,Republic,358,2004-9-15,6393
226042758,Plato's Symposium,199,2001-2-1,6394
140446168,The Symposium,90,1999-10-1,6395
140449280,The Last Days of Socrates,256,2003-3-27,6396
1933440171,Embracing Love  Vol. 4,208,2007-1-1,6397
193344018X,Embracing Love  Vol. 5,216,2007-4-1,6398
60667419,Embracing the Love of God: The Path and Promise of Christian Life,192,1995-6-28,6399
1933440198,Embracing Love  Vol. 6,216,2008-6-1,6400
192839659,Jane Eyre,452,2001-2-1,6401
440228166,In the Forests of the Night,147,2000-2-2,6402
044023803X,Hawksong (The Kiesha'ra  #1),243,2004-9-28,6403
440228840,Demon in My View,192,2001-9-11,6404
440229405,Shattered Mirror,240,2003-7-8,6405
440237971,Midnight Predator,256,2003-12-9,6406
520024273,The Pound Era,624,1973-9-18,6407
1416532358,Ricochet,400,2007-1-2,6408
446618675,The Alibi,564,2006-11-1,6409
055329783X,A Whole New Light,227,2008-8-26,6410
446600342,Where There's Smoke,512,1994-5-1,6411
553290851,22 Indigo Place,200,1997-2-25,6412
778321584,Led Astray (Hellraisers  #1),240,2005-2-22,6413
553576003,Tidings of Great Joy,231,1999-11-2,6414
077832284X,A Secret Splendor,280,2006-2-28,6415
446616834,Love Beyond Reason,272,2005-4-1,6416
446614165,Words of Silk,224,2005-4-1,6417
778324311,Two Alone,282,2007-2-27,6418
044661291X,Not Even for Love,208,2004-4-1,6419
446601853,Charade,496,1995-7-1,6420
446604232,Exclusive,496,1997-7-1,6421
553576011,Send No Flowers (Bed & Breakfast #2),225,2000-2-29,6422
1551666723,The Thrill of Victory,240,2003-2-21,6423
553571575,Heaven's Price,240,1995-11-1,6424
9792234799,Riley in the Morning,224,2008-11-27,6425
553576054,The Rana Look,256,2003-12-2,6426
553295004,Texas! Sage (Texas! Tyler Family Saga  #3),352,1992-2-1,6427
553804081,Temperatures Rising,214,2006-11-28,6428
446612618,A Kiss Remembered,224,2003-4-1,6429
553567683,Adam's Fall (Mason Sisters  #2),208,2001-11-27,6430
446603104,Seduction by Design,224,2002-3-1,6431
446364290,Prime Time,256,1995-9-1,6432
155166531X,Tiger Prince,304,1999-9-24,6433
446533289,Best Kept Secrets,480,2003-11-3,6434
1551666014,Tomorrow's Promise,304,2000-5-25,6435
446603082,Sweet Anger,320,1999-1-1,6436
553576070,Demon Rumm,230,2005-11-29,6437
553571583,Breakfast in Bed (Bed & Breakfast #1),240,1996-11-4,6438
077832026X,Above and Beyond,240,2004-2-23,6439
553562746,Fanta C (Mason Sisters  #1),256,1997-1-21,6440
515068705,Relentless Desire,183,1983-12-31,6441
553576062,Sunny Chandler's Return,256,2004-11-23,6442
517077744,Sandra Brown: Three Complete Novels (Best Kept Secrets  Mirror Image  and Slow Heat in Heaven),784,1992-4-14,6443
1551667932,The Devil's Own (Hellraiser #2),240,2001-2-22,6444
749932554,The Switch,576,2001-9-6,6445
743289358,Play Dirty,404,2007-8-14,6446
1551660954,A Secret Splendor,297,1996-1-1,6447
385424701,Texas! Trilogy,600,1992-4-1,6448
3764501359,Betrogen,512,2003-2-1,6449
446616818,Tempest in Eden,229,2005-4-1,6450
553569694,The Killing of Monday Brown,320,1996-7-1,6451
1400001048,Un nuevo amanecer,560,2002-1-22,6452
553218360,Fanta C (Loveswept   #217),192,1987-10-1,6453
8401505534,Anhelos ocultos,380,1996-3-27,6454
3442354994,Schöne Lügen,255,2001-9-1,6455
684867486,Yesterday  I Cried,304,2000-3-2,6456
140447571,The Communist Manifesto,288,2002-6-27,6457
486424650,The Communist Manifesto and Other Revolutionary Writings: Marx  Marat  Paine  Mao  Gandhi  and Others,284,2003-1-15,6458
312157118,The Communist Manifesto with Related Documents,184,1999-2-28,6459
1931859256,The Communist Manifesto,221,2005-10-1,6460
1599869950,The Communist Manifesto,88,2005-12-26,6461
1593083750,The Communist Manifesto and Other Writings,224,2005-10-1,6462
717802418,The Communist Manifesto,48,1948-6-1,6463
014303751X,The Communist Manifesto (Great Ideas),128,2006-5-30,6464
670038164,Paula Spencer,281,2007-1-1,6465
2264022442,Paddy Clarke Ha Ha Ha,307,1998-6-4,6466
1840466723,Introducing Sartre (Introducing... S.),176,2002-4-24,6467
041537846X,Colonialism and Neocolonialism,252,2006-3-29,6468
60520590,Tête-à-Tête: Simone de Beauvoir and Jean-Paul Sartre,432,2005-10-4,6469
786169427,Jean-Paul Sartre: (The Giants of Philosophy),3,2006-4-1,6470
520240782,Observations on the Feeling of the Beautiful and Sublime,124,2004-1-15,6471
192835807,A Philosophical Enquiry into the Origin of our Ideas of the Sublime and Beautiful,208,1998-11-19,6472
1555974325,American Sublime: Poems,96,2005-10-1,6473
1581150377,Beauty and the Contemporary Sublime,180,1999-12-1,6474
822316412,Cigarettes Are Sublime,232,1995-1-20,6475
295979259,The Art of the Ridiculous Sublime: On David Lynch's Lost Highway,56,2000-4-1,6476
465030505,Why Orwell Matters,211,2003-9-11,6477
141187395,Shooting an Elephant,368,2003-6-5,6478
929587782,Ape and Essence,222,1992-8-25,6479
